{
  "id": "meitav-chisachon-lekol-yeled-sikun-muat",
  "institution": "meitav",
  "where_seen": "Meitav, רשימת מסלולי ההשקעה בתוכנית חסכון לכל ילד של מיטב (דוחות תשואה חסכון לכל ילד), https://www.meitav.co.il/provident_pension/kids_reports/; Meitav, חיסכון לכל ילד – מידע להורים, https://www.meitav.co.il/provident_pension/saving_for_every_kid/",
  "seen_on": "2026-10-23",
  "seen_by": "this collection",
  "names": {
    "he": [
      "מיטב חסכון לכל ילד - סיכון מועט",
      "מסלול לחוסכים בסיכון נמוך"
    ]
  },
  "maps_to": {
    "wrapper_id": "child-savings-provident",
    "cma_fund_id": null,
    "track_ids": [
      11385
    ]
  },
  "near_duplicates": [],
  "status": "catalogued",
  "notes": "Track of Meitav's child-savings investment provident fund (regulator classification \"קופת גמל להשקעה - חסכון לילד\"), the kupat gemel lehashkaa side of the National Insurance \"חיסכון לכל ילד\" programme. cma_fund_id is null: no Meitav document read gives the parent fund number. The reports page writes \"סיכון מועט\" (as the regulator); the kid page's list writes \"מסלול לחוסכים בסיכון נמוך\"."
}
