{
  "id": "meitav-gemel-lehashkaa-meniyot-sachir",
  "institution": "meitav",
  "where_seen": "Meitav, רשימת מסלולי ההשקעה בקופת הגמל להשקעה של מיטב (דוחות תשואה גמל להשקעה), https://www.meitav.co.il/provident_pension/kupa_gemel_invest_reports/; Meitav operations flyer (פלייר תפעולי), p.3 \"גמל להשקעה - מ.ה קופה 7857\", https://www.meitav.co.il/media/0lhfrzgy/פלייר-תפעולי-מונגש.pdf; Meitav merger notice, מיזוג מסלולי השקעה בקופת הגמל \"מיטב גמל להשקעה\" (7857), May 2024, tree diagrams before and after the merger, https://www.meitav.co.il/media/41anarx5/מיזוג-גמל-להשקעה-7981.pdf",
  "seen_on": "2026-10-23",
  "seen_by": "this collection; il-finance CAT-25, CAT-26",
  "names": {
    "he": [
      "מיטב גמל להשקעה מניות סחיר"
    ]
  },
  "maps_to": {
    "wrapper_id": "kupat-gemel-lehashkaa",
    "cma_fund_id": 7857,
    "track_ids": [
      15350
    ]
  },
  "near_duplicates": [],
  "status": "catalogued",
  "notes": "Track of Meitav's investment provident fund \"מיטב גמל להשקעה\", fund (קופה) number 7857 (flyer p.3; merger notice). New track from 1.7.2024 (flyer p.3, no old name). Listed under the page's group \"מסלולים מנייתים\"."
}
